{
  "$schema": "https://json-schema.org/draft/2020-12/schema",
  "title": "Level",
  "description": "Уровень-сетка из тайлов. Координаты в тайлах; сущности привязаны к нижней границе клетки (origin ног = низ клетки). Ряд 0 — верхний.",
  "type": "object",
  "required": ["id", "tile_size", "width", "height", "legend", "rows", "player_spawn", "enemies"],
  "properties": {
    "$schema": { "type": "string" },
    "id": { "type": "string" },
    "display_name": { "type": "string" },
    "debug_key": { "type": "integer", "minimum": 1, "maximum": 9, "description": "Отладка: клавиша 1–9 в игре переключает на этот уровень" },
    "background_id": { "type": "string", "description": "Id параллакс-фона из data/backgrounds/ (необязательно)" },
    "tile_size": { "type": "integer", "minimum": 1 },
    "width": { "type": "integer", "minimum": 1, "description": "Ширина в тайлах (длина каждой строки rows)" },
    "height": { "type": "integer", "minimum": 1, "description": "Высота в тайлах (число строк rows)" },
    "legend": {
      "type": "object",
      "description": "Символ строки rows -> id тайла из data/tiles/tiles.json (null = пусто)",
      "additionalProperties": { "type": ["string", "null"] }
    },
    "rows": { "type": "array", "items": { "type": "string" } },
    "player_spawn": {
      "type": "object",
      "required": ["x", "y"],
      "description": "Клетка, на нижней границе которой появляется игрок",
      "properties": { "x": { "type": "integer" }, "y": { "type": "integer" } }
    },
    "decor": {
      "type": "array",
      "description": "Декор: спрайты без коллизии. x, y — в тайлах (могут быть дробными): точка привязки спрайта (origin из sprites.json) ставится в (x*tile_size, y*tile_size)",
      "items": {
        "type": "object",
        "required": ["sprite_id", "x", "y"],
        "properties": {
          "sprite_id": { "type": "string" },
          "x": { "type": "number" },
          "y": { "type": "number" },
          "layer": { "type": "string", "enum": ["back", "front"], "description": "back — за тайлами (фон: куллер), front — поверх тайлов, под героем и врагами (по умолчанию)" },
          "flip_x": { "type": "boolean", "description": "Отразить рисунок по горизонтали (вокруг точки привязки)" },
          "flip_y": { "type": "boolean", "description": "Отразить рисунок по вертикали" }
        }
      }
    },
    "tile_xform": {
      "type": "array",
      "description": "Повороты и отражения отдельных тайлов: рисунок отражается (flip_x, flip_y), затем поворачивается по часовой стрелке на rot. Скосы (slope) при этом меняют сторону — коллизия следует за рисунком. Единичные преобразования не хранятся.",
      "items": {
        "type": "object",
        "required": ["x", "y"],
        "properties": {
          "x": { "type": "integer" },
          "y": { "type": "integer" },
          "flip_x": { "type": "boolean" },
          "flip_y": { "type": "boolean" },
          "rot": { "type": "integer", "enum": [90, 180, 270] }
        }
      }
    },
    "threads": {
      "type": "array",
      "description": "Нитки, поставленные на конкретные пиксели (x, y — пиксели мира). vine — физичная лиана вниз от точки (pieces звеньев по 14 px), sky — длинная нитка как у паучихи: верх в точке, свободный низ на глубине length, качается на swing px.",
      "items": {
        "type": "object",
        "required": ["kind", "x", "y"],
        "properties": {
          "kind": { "type": "string", "enum": ["vine", "sky"] },
          "x": { "type": "number" },
          "y": { "type": "number" },
          "pieces": { "type": "integer", "minimum": 1, "maximum": 12 },
          "length": { "type": "number", "minimum": 16 },
          "swing": { "type": "number", "minimum": 0 },
          "bead": { "type": "boolean", "description": "Капля на конце" }
        }
      }
    },
    "objects": {
      "type": "array",
      "description": "Объекты из каталога data/objects/placeables.json: двери, квестовые предметы, подставки. x, y — пиксели мира, точка привязки спрайта (у стоящих на полу — низ по центру). props — поля, описанные у типа в каталоге.",
      "items": {
        "type": "object",
        "required": ["id", "type", "x", "y"],
        "properties": {
          "id": { "type": "string", "description": "Уникален на уровне: на него ссылаются двери (to_door) и сохранения" },
          "type": { "type": "string", "description": "Тип из placeables.json: door, battery, battery_stand, password…" },
          "x": { "type": "number" },
          "y": { "type": "number" },
          "flip_x": { "type": "boolean" },
          "props": { "type": "object", "additionalProperties": { "type": ["string", "number", "boolean"] } }
        }
      }
    },
    "fog": {
      "description": "Туман войны: true или { mode } — вне комнаты, где стоит герой, мир чёрный (нужен список rooms). mode: current — только текущая комната, explored — ещё и уже посещённые.",
      "oneOf": [
        { "type": "boolean" },
        { "type": "object", "properties": { "mode": { "type": "string", "enum": ["current", "explored"] } } }
      ]
    },
    "start_armor": { "type": "integer", "minimum": 1, "maximum": 2, "description": "Герой входит на уровень в частях этой модели: 1 — прежний герой, 2 — герой второй локации (части выдаются и надеваются, где надето что-то слабее)" },
    "terminals": {
      "type": "array",
      "description": "Терминалы брони: герой подходит и нажимает E — открывается окно покупки и смены брони за металлолом. Спрайт ставится нижним центром в нижнюю границу клетки (x, y).",
      "items": {
        "type": "object",
        "required": ["sprite_id", "x", "y"],
        "properties": {
          "sprite_id": { "type": "string" },
          "x": { "type": "integer" },
          "y": { "type": "integer" }
        }
      }
    },
    "light": {
      "type": "object",
      "description": "Цвета света от фона на уровне: контровая кромка на краях предметов и туман у земли (по умолчанию зелёные). Цвета — из палитры проекта.",
      "properties": {
        "rim_color": { "type": "string", "pattern": "^#[0-9a-fA-F]{6}$" },
        "fog_color": { "type": "string", "pattern": "^#[0-9a-fA-F]{6}$" }
      }
    },
    "grade": {
      "type": "object",
      "description": "Цветокоррекция уровня на готовый кадр: насыщенность, контраст, виньетка и раздельное тонирование. shadows/highlights — RGB-добавки (0..1) к тёмным и светлым тонам в начале уровня, *_end — в конце: по уровню тона плавно переходят.",
      "properties": {
        "exposure": { "type": "number", "minimum": 0, "description": "Общая яркость (<1 — темнее)" },
        "gamma": { "type": "number", "minimum": 0.1, "description": ">1 — средние тона темнее" },
        "tint": { "type": "array", "items": { "type": "number" }, "minItems": 3, "maxItems": 3, "description": "Множитель цвета RGB: общий оттенок кадра (зелёный — убрать красный и синий)" },
        "saturation": { "type": "number", "minimum": 0 },
        "contrast": { "type": "number", "minimum": 0 },
        "vignette": { "type": "number", "minimum": 0, "maximum": 1 },
        "shadows": { "type": "array", "items": { "type": "number" }, "minItems": 3, "maxItems": 3 },
        "highlights": { "type": "array", "items": { "type": "number" }, "minItems": 3, "maxItems": 3 },
        "shadows_end": { "type": "array", "items": { "type": "number" }, "minItems": 3, "maxItems": 3 },
        "highlights_end": { "type": "array", "items": { "type": "number" }, "minItems": 3, "maxItems": 3 }
      }
    },
    "zones": {
      "type": "array",
      "description": "УСТАРЕЛО: зоны автодекора больше не раскладываются игрой. Редактор при открытии превращает их в обычные предметы (decor, threads) и удаляет поле.",
      "items": {
        "type": "object",
        "required": ["kind", "x0", "y0", "x1", "y1"],
        "properties": {
          "kind": { "type": "string", "enum": ["transistors", "webs"], "description": "transistors — транзисторы на верхних гранях тайлов; webs — висящая паутина из нитки паучихи: физичные лианы под нижними гранями тайлов и длинные нитки с неба (как у паучихи); в зоне их тем больше, чем выше density" },
          "x0": { "type": "integer" }, "y0": { "type": "integer" }, "x1": { "type": "integer" }, "y1": { "type": "integer" },
          "density": { "type": "number", "minimum": 0, "maximum": 1, "description": "Вероятность декора на подходящую клетку (по умолчанию 0.5)" }
        }
      }
    },
    "enemies": {
      "type": "array",
      "items": {
        "type": "object",
        "required": ["enemy_id", "sprite_id", "x", "y"],
        "properties": {
          "enemy_id": { "type": "string", "description": "Id из data/enemies/enemies.json" },
          "sprite_id": { "type": "string", "description": "Вариант внешности (должен быть в sprite_variants врага)" },
          "x": { "type": "integer" },
          "y": { "type": "integer" },
          "surface": { "type": "string", "enum": ["floor", "ceiling", "wall_left", "wall_right"], "description": "Только для ползающих врагов: на какой поверхности появляется (по умолчанию floor). wall_right — стена справа от клетки, wall_left — слева" },
          "room": { "type": "string", "description": "Id комнаты-«дома»: моб замечает героя и атакует только в ней. По умолчанию — комната, в которой он стоит" },
          "anchor_y": { "type": "integer", "description": "Только для висящих на нитке (паучиха): ряд тайлов, где закреплён верх нитки (может быть отрицательным — за верхом уровня); по умолчанию -2" },
          "length": { "type": "integer", "minimum": 3, "maximum": 5, "description": "Только для червей: длина в сегментах (по умолчанию случайная в пределах рига)" }
        }
      }
    },
    "rooms": {
      "type": "array",
      "description": "Комнаты уровня: что видит герой внутри (вне комнаты — туман войны) и «дом» для мобов и боссов (они нападают только в своей комнате). Границы — прямоугольник x, y, width, height в клетках; mask — какие клетки внутри него принадлежат комнате. Комнаты могут перекрываться (проём между ними принадлежит обеим).",
      "items": {
        "type": "object",
        "required": ["id", "x", "y", "width", "height"],
        "properties": {
          "id": { "type": "string" },
          "name": { "type": "string" },
          "x": { "type": "integer" },
          "y": { "type": "integer" },
          "width": { "type": "integer" },
          "height": { "type": "integer" },
          "mask": { "type": "array", "items": { "type": "string", "pattern": "^[#.]*$" }, "description": "height рядов по width символов: # — клетка комнаты, . — нет. Без mask комната — весь прямоугольник" },
          "color": { "type": "string" },
          "beveled": { "type": "boolean" },
          "location": { "type": "integer", "minimum": 1, "description": "Номер локации (1, 2, 3...), к которой привязана комната" },
          "background_id": { "type": "string", "description": "Id фона из data/backgrounds: включается, когда герой входит в комнату (плавная смена); без него — фон уровня" }
        }
      }
    },
    "spawn_zones": {
      "type": "array",
      "description": "Зоны появления мобов строго на полу",
      "items": {
        "type": "object",
        "required": ["id", "enemy_id", "x", "y", "width", "height", "count"],
        "properties": {
          "id": { "type": "string" },
          "name": { "type": "string" },
          "enemy_id": { "type": "string" },
          "sprite_id": { "type": "string" },
          "x": { "type": "integer" },
          "y": { "type": "integer" },
          "width": { "type": "integer" },
          "height": { "type": "integer" },
          "count": { "type": "integer", "minimum": 1 },
          "surface": { "type": "string", "enum": ["floor", "ceiling", "wall"] }
        }
      }
    }
  }
}
