{
  "$schema": "../schemas/level.schema.json",
  "id": "boss_worm",
  "display_name": "Арена: червь-пожиратель",
  "debug_key": 3,
  "start_armor": 1,
  "background_id": "bg_textalite",
  "tile_size": 32,
  "width": 50,
  "height": 22,
  "legend": {
    ".": null,
    "#": "textalite_5",
    "@": "textalite_1",
    "%": "textalite_2",
    "&": "textalite_3",
    "$": "textalite_9",
    "A": "textalite_7",
    "B": "textalite_0",
    "C": "textalite_8",
    "D": "textalite_6",
    "E": "textalite_4"
  },
  "rows": [
    "#................................................#",
    "#................................................#",
    "#................................................#",
    "#................................................#",
    "#................................................#",
    "#................................................#",
    "#................................................#",
    "#................................................#",
    "#................................................#",
    "#................................................#",
    "#................................................#",
    "#.................ADCD#AADCD#AA..................#",
    "#................................................#",
    "#................................................#",
    "#................................................#",
    "#.....ADCD#A.........................ADCD#A......#",
    "#................................................#",
    "#................................................#",
    "#................................................#",
    "#DACD##A#CCDCD#ADAA#AC#%##E$#C#DACD##A#CCDCD#ADAA#",
    "##################################################",
    "##################################################"
  ],
  "player_spawn": {
    "x": 3,
    "y": 18
  },
  "terminals": [
    {
      "sprite_id": "terminal_loc1",
      "x": 6,
      "y": 18
    }
  ],
  "enemies": [
    {
      "enemy_id": "worm_boss",
      "sprite_id": "boss_textalite",
      "x": 25,
      "y": 8,
      "is_boss": true,
      "boss_id": "worm_boss"
    }
  ],
  "grade": {
    "saturation": 1.08,
    "contrast": 1.1,
    "vignette": 0.36,
    "exposure": 1.02,
    "gamma": 1.08,
    "tint": [
      0.82,
      1,
      0.9
    ],
    "shadows": [
      0,
      0.035,
      0.02
    ],
    "highlights": [
      0.02,
      0.06,
      0.03
    ],
    "shadows_end": [
      0,
      0.03,
      0.04
    ],
    "highlights_end": [
      0.04,
      0.05,
      0
    ]
  },
  "objects": []
}
