{
  "$schema": "../schemas/level.schema.json",
  "id": "loc3",
  "display_name": "Локация 3 (заготовка)",
  "debug_key": 3,
  "start_armor": 2,
  "background_id": "bg_textalite",
  "tile_size": 32,
  "width": 36,
  "height": 18,
  "legend": {
    "#": "platform_block",
    ".": null
  },
  "rows": [
    "####################################",
    "#..................................#",
    "#..................................#",
    "#..................................#",
    "#..................................#",
    "#..................................#",
    "#..................................#",
    "#..................................#",
    "#..................................#",
    "#..................................#",
    "#..................................#",
    "#..................................#",
    "#..................................#",
    "#..................................#",
    "#..................................#",
    "#..................................#",
    "####################################",
    "####################################"
  ],
  "player_spawn": {
    "x": 3,
    "y": 15
  },
  "terminals": [
    {
      "sprite_id": "terminal_loc2",
      "x": 7,
      "y": 15
    }
  ],
  "enemies": []
}
