{
  "$schema": "../schemas/level.schema.json",
  "id": "LOC1E",
  "display_name": "вар5лок1",
  "tile_size": 32,
  "width": 40,
  "height": 20,
  "legend": {
    ".": null,
    "@": "doptileset"
  },
  "rows": [
    "........................................",
    "........................................",
    "........................................",
    "........................................",
    "........................................",
    "........................................",
    "......@@@@@@@@@@@@@@@@@@@@@@@@@@@@......",
    "......@....@................@....@......",
    "......@....@................@....@......",
    "......@....@................@....@......",
    "......@....@................@....@......",
    "......@..@@@....@@@..@@@....@@@..@......",
    "......@..........................@......",
    "......@..........................@......",
    "......@..........................@......",
    "......@....@@@@@..@@@@..@@@@@....@......",
    "......@........@........@........@......",
    "...............@........@...............",
    "...............@........@...............",
    "......@@@@@@@@@@@@@@@@@@@@@@@@@@@@......"
  ],
  "player_spawn": {
    "x": 8,
    "y": 18
  },
  "enemies": [],
  "background_id": "bg_textalite",
  "objects": [
    {
      "id": "door_1",
      "type": "door",
      "x": 208,
      "y": 608
    },
    {
      "id": "door_2",
      "type": "door",
      "x": 1072,
      "y": 608
    }
  ],
  "rooms": [
    {
      "id": "room_1",
      "name": "Комната 1",
      "x": 6,
      "y": 6,
      "width": 28,
      "height": 14
    }
  ],
  "fog": true
}
