{
  "$schema": "../schemas/level.schema.json",
  "id": "test_level",
  "display_name": "Тестовая плата",
  "background_id": "bg_textalite",
  "tile_size": 32,
  "width": 30,
  "height": 16,
  "legend": {
    "#": "platform_block",
    ".": null
  },
  "rows": [
    "..............................",
    "..............................",
    "..............................",
    "..........................#...",
    "..........................#...",
    "..........................#...",
    "..........................#...",
    "..........................#...",
    "..........................#...",
    "..........................#...",
    "..........................#...",
    "...................####...#...",
    "...####.####..............#...",
    ".......................#..#...",
    ".......................#..#...",
    "##############################"
  ],
  "player_spawn": {
    "x": 2,
    "y": 14
  },
  "enemies": [
    {
      "enemy_id": "transistoid",
      "sprite_id": "enemy_transistoid_purple",
      "x": 13,
      "y": 14
    },
    {
      "enemy_id": "transistoid",
      "sprite_id": "enemy_transistoid_amber",
      "x": 21,
      "y": 14
    },
    {
      "enemy_id": "transistoid",
      "sprite_id": "enemy_transistoid_purple",
      "x": 21,
      "y": 10
    },
    {
      "enemy_id": "swire",
      "sprite_id": "enemy_swire",
      "x": 23,
      "y": 12
    },
    {
      "enemy_id": "spider",
      "sprite_id": "enemy_spider",
      "x": 10,
      "y": 14,
      "surface": "floor"
    },
    {
      "enemy_id": "spider",
      "sprite_id": "enemy_spider",
      "x": 20,
      "y": 10,
      "surface": "floor"
    },
    {
      "enemy_id": "spider",
      "sprite_id": "enemy_spider",
      "x": 25,
      "y": 8,
      "surface": "wall_right"
    },
    {
      "enemy_id": "worm",
      "sprite_id": "enemy_worm",
      "x": 12,
      "y": 14,
      "surface": "floor",
      "length": 4
    },
    {
      "enemy_id": "worm",
      "sprite_id": "enemy_worm",
      "x": 19,
      "y": 14,
      "surface": "floor",
      "length": 5
    },
    {
      "enemy_id": "spider_mother",
      "sprite_id": "enemy_spider_mother",
      "x": 12,
      "y": 8,
      "anchor_y": -2
    }
  ],
  "decor": [
    {
      "sprite_id": "deco_cooler",
      "x": 15.5,
      "y": 15,
      "layer": "back",
      "solid_cells": [
        [
          14,
          12,
          3,
          3
        ]
      ]
    }
  ],
  "zones": [
    {
      "kind": "transistors",
      "x0": 3,
      "y0": 10,
      "x1": 10,
      "y1": 15,
      "density": 0.6
    },
    {
      "kind": "webs",
      "x0": 18,
      "y0": 8,
      "x1": 25,
      "y1": 15,
      "density": 0.65
    }
  ]
}
