{
  "$schema": "../schemas/level.schema.json",
  "id": "loc2_boss",
  "display_name": "Арена: Бонзай",
  "debug_key": 5,
  "start_armor": 2,
  "background_id": "bg_loc2",
  "light": {
    "rim_color": "#3de9e6",
    "fog_color": "#22c5cd"
  },
  "tile_size": 32,
  "width": 46,
  "height": 22,
  "legend": {
    ".": null,
    "#": "loc2_fill",
    "=": "loc2_top_clean",
    "/": "loc2_top_groove",
    "r": "loc2_top_rust_l",
    "R": "loc2_top_rust_r",
    "m": "loc2_top_moss_1",
    "M": "loc2_top_moss_2",
    "*": "loc2_top_moss_rust",
    "[": "loc2_edge_left",
    "]": "loc2_edge_right",
    "-": "loc2_panel_clean",
    "~": "loc2_panel_groove",
    "x": "loc2_panel_rust_l",
    "X": "loc2_panel_rust_heavy"
  },
  "rows": [
    "##############################################",
    "#............................................#",
    "#............................................#",
    "#............................................#",
    "#............................................#",
    "#............................................#",
    "#............................................#",
    "#............................................#",
    "#............................................#",
    "#............................................#",
    "#..................[r//m=R]..................#",
    "#............................................#",
    "#............................................#",
    "#............................................#",
    "#............................................#",
    "#........[r//=Mm]............[=//m*rM].......#",
    "#............................................#",
    "#............................................#",
    "#............................................#",
    "#............................................#",
    "#=r//m=M*r/=mMr=//m=M*r/=mMr=//m=M*r/=mMr=//m#",
    "#-~xX-~xX-~xX-~xX-~xX-~xX-~xX-~xX-~xX-~xX-~xX#"
  ],
  "player_spawn": {
    "x": 4,
    "y": 19
  },
  "decor": [
    {
      "sprite_id": "deco_cable_bundle",
      "x": 10,
      "y": 1,
      "layer": "back"
    },
    {
      "sprite_id": "deco_cable_bundle",
      "x": 23,
      "y": 1,
      "layer": "back"
    },
    {
      "sprite_id": "deco_cable_bundle",
      "x": 36,
      "y": 1,
      "layer": "back"
    },
    {
      "sprite_id": "deco_pipe_fg_left",
      "x": 0.5,
      "y": 18,
      "layer": "front"
    },
    {
      "sprite_id": "deco_pipe_fg_left",
      "x": 44.5,
      "y": 18,
      "layer": "front",
      "flip_x": true
    },
    {
      "sprite_id": "deco_moss_tuft_fg",
      "x": 12,
      "y": 18,
      "layer": "front"
    },
    {
      "sprite_id": "deco_moss_tuft_fg",
      "x": 33,
      "y": 18,
      "layer": "front"
    }
  ],
  "terminals": [
    {
      "sprite_id": "terminal_loc2",
      "x": 7,
      "y": 19
    }
  ],
  "enemies": [
    {
      "enemy_id": "bonzai_boss",
      "sprite_id": "boss_bonzai",
      "x": 34,
      "y": 8,
      "is_boss": true,
      "boss_id": "bonzai_boss"
    }
  ],
  "objects": []
}
