{
  "$schema": "../schemas/level.schema.json",
  "id": "loc6",
  "display_name": "Локация 6: Краб-Ядро",
  "debug_key": 5,
  "start_armor": 2,
  "background_id": "bg_loc6",
  "light": {
    "rim_color": "#f76bfc",
    "fog_color": "#9600ca"
  },
  "tile_size": 32,
  "width": 52,
  "height": 22,
  "legend": {
    ".": null,
    "#": "loc2"
  },
  "rows": [
    "####################################################",
    "#..................................................#",
    "#..................................................#",
    "#..................................................#",
    "#..................................................#",
    "#..................................................#",
    "#..................................................#",
    "#..................................................#",
    "#..................................................#",
    "#..................................................#",
    "#..................................................#",
    "#...........#####..................#####...........#",
    "#..................................................#",
    "#..................................................#",
    "#..................................................#",
    "#....#####................................#####....#",
    "#...................############...................#",
    "#..................................................#",
    "#..................................................#",
    "#..................................................#",
    "####################################################",
    "####################################################"
  ],
  "player_spawn": {
    "x": 3,
    "y": 19
  },
  "decor": [],
  "terminals": [
    {
      "sprite_id": "terminal_loc2",
      "x": 7,
      "y": 19
    }
  ],
  "enemies": [
    {
      "enemy_id": "krab_boss",
      "sprite_id": "boss_krab",
      "x": 38,
      "y": 19,
      "is_boss": true,
      "boss_id": "krab_boss"
    }
  ],
  "objects": []
}
