{
  "$schema": "../schemas/level.schema.json",
  "id": "loc4",
  "display_name": "Локация 4 (заготовка)",
  "debug_key": 4,
  "background_id": "bg_textalite",
  "tile_size": 32,
  "width": 36,
  "height": 18,
  "legend": {
    "#": "platform_block",
    ".": null
  },
  "rows": [
    "####################################",
    "#..................................#",
    "#..................................#",
    "#..................................#",
    "#..................................#",
    "#..................................#",
    "#..................................#",
    "#..................................#",
    "#..................................#",
    "#..................................#",
    "#..................................#",
    "#..................................#",
    "#..................................#",
    "#..................................#",
    "#..................................#",
    "#..................................#",
    "####################################",
    "####################################"
  ],
  "player_spawn": {
    "x": 3,
    "y": 15
  },
  "enemies": []
}
