{
  "$schema": "../schemas/level.schema.json",
  "id": "LOC1D",
  "display_name": "вар4лок1",
  "tile_size": 32,
  "width": 40,
  "height": 20,
  "legend": {
    ".": null,
    "@": "doptileset",
    "%": "step",
    "&": "platform_loop_1"
  },
  "rows": [
    "........................................",
    "........................................",
    "........................................",
    "........................................",
    "........................................",
    ".....@@@@@@@@@@@@@@@@@@@@@@@@@@@@@@.....",
    ".....@............................@.....",
    ".....@............................@.....",
    ".....@............................@.....",
    ".....@..........@@@@@@@@..........@.....",
    ".....@............................@.....",
    ".....@............................@.....",
    ".....@.....@@@............@@@.....@.....",
    ".....@............................@.....",
    ".....@............................@.....",
    ".....@............................@.....",
    ".....@.......%&&&&&&&&&&&&%.......@.....",
    "............%@@@@@@@@@@@@@@%............",
    "...........%@@@@@@@@@@@@@@@@%...........",
    ".....@@@@@@@@@@@@@@@@@@@@@@@@@@@@@@....."
  ],
  "player_spawn": {
    "x": 8,
    "y": 18
  },
  "enemies": [],
  "background_id": "bg_textalite",
  "objects": [
    {
      "id": "door_1",
      "type": "door",
      "x": 176,
      "y": 608
    },
    {
      "id": "door_2",
      "type": "door",
      "x": 1104,
      "y": 608
    }
  ],
  "tile_xform": [
    {
      "x": 28,
      "y": 18,
      "flip_x": true
    },
    {
      "x": 27,
      "y": 17,
      "flip_x": true
    },
    {
      "x": 26,
      "y": 16,
      "flip_x": true
    }
  ],
  "rooms": [
    {
      "id": "room_1",
      "name": "Комната 1",
      "x": 5,
      "y": 5,
      "width": 30,
      "height": 15
    }
  ],
  "fog": true
}
